,author,quotes
32,Confucius Quotes,"The essence of knowledge is, having it, to apply it not having it, to confess your ignorance."
33,Confucius Quotes,A man who does not plan long ahead will find trouble right at his door.
34,Confucius Quotes,Humility is the solid foundation of all the virtues.
35,Confucius Quotes,"With coarse rice to eat, with water to drink, and my bended arm for a pillow – I have still joy in the midst of these things. Riches and honors acquired by unrighteousness are to me as a floating cloud."
36,Confucius Quotes,"When anger rises, think of the consequences."
37,Confucius Quotes,Study the past if you would define the future.
38,Confucius Quotes,To be wronged is nothing unless you continue to remember it.
39,Confucius Quotes,The scholar who cherishes the love of comfort is not fit to be deemed a scholar.
40,Confucius Quotes,"Wheresoever you go, go with all your heart."
41,Confucius Quotes,The real fault is to have faults and not amend them.
42,Confucius Quotes,"When we see men of a contrary character, we should turn inwards and examine ourselves."
43,Confucius Quotes,"He with whom neither slander that gradually soaks into the mind, nor statements that startle like a wound in the flesh, are successful may be called intelligent indeed."
44,Confucius Quotes,"The faults of a superior person are like the sun and moon. They have their faults, and everyone sees them; they change and everyone looks up to them."
45,Confucius Quotes,"A fool despises good counsel, but a wise man takes it to heart."
46,Confucius Quotes,He who will not economize will have to agonize.
47,Confucius Quotes,"I am not concerned that I am not known, I seek to be worthy to be known."
48,Confucius Quotes,They must change who would be constant in happiness and wisdom.
49,Confucius Quotes,"Without an acquaintance with the rules of propriety, it is impossible for the character to be established."
50,Confucius Quotes,Mankind differs from the animals only by a little and most people throw that away.
51,Confucius Quotes,"To see what is right, and not to do it, is want of courage or of principle."
52,Confucius Quotes,It is better to light one small candle than to curse the darkness.
53,Confucius Quotes,Respect yourself and others will respect you.
54,Confucius Quotes,"When prosperity comes, do not use all of it."
55,Confucius Quotes,"Ignorance is the night of the mind, but a night without moon and star."
56,Confucius Quotes,"I am not one who was born in the possession of knowledge; I am one who is fond of antiquity, and earnest in seeking it there."
57,Confucius Quotes,They must often change who would be constant in happiness or wisdom.
58,Confucius Quotes,"The more man meditates upon good thoughts, the better will be his world and the world at large."
59,Confucius Quotes,"When you know a thing, to hold that you know it; and when you do not know a thing, to allow that you do not know it – this is knowledge."
60,Confucius Quotes,We take greater pains to persuade others that we are happy than in endeavoring to think so ourselves.
61,Confucius Quotes,"To put the world in order, we must first put the nation in order; to put the nation in order, we must put the family in order; to put the family in order, we must cultivate our personal life; and to cultivate our personal life, we must first set our hearts right."
62,Confucius Quotes,"To be able to practice five things everywhere under heaven constitutes perfect virtue…They are gravity, generosity of soul, sincerity, earnestness, and kindness."
63,Confucius Quotes,"If a man takes no thought about what is distant, he will find sorrow near at hand."
64,Confucius Quotes,Behave toward everyone as if receiving a great guest.
65,Confucius Quotes,What the superior man seeks is in himself; what the small man seeks is in others.
66,Confucius Quotes,The strength of a nation derives from the integrity of the home.
67,Confucius Quotes,"There are three things to beware of through life: when a man is young, let him beware of his appetites; when he is middle-aged, of his passions; and when old, of covetousness, especially."
68,Confucius Quotes,"When you see a worthy person, endeavor to emulate him. When you see an unworthy person, then examine your inner self."
69,Confucius Quotes,"When a man’s knowledge is sufficient to attain, and his virtue is not sufficient to enable him to hold, whatever he may have gained, he will lose again."
70,Confucius Quotes,"Wealth and rank are what people desire, but unless they be obtained in the right way they may not be possessed."
71,Confucius Quotes,"The wheel of fortune turns round incessantly, and who can say to himself, I shall today be uppermost."
72,Confucius Quotes,The father who does not teach his son his duties is equally guilty with the son who neglects them.
73,Confucius Quotes,"The parents age must be remembered, both for joy and anxiety."
74,Confucius Quotes,"When I walk along with two others, from at least one I will be able to learn."
75,Confucius Quotes,"If you look into your own heart, you find nothing wrong there, what is there to fear?"
76,Confucius Quotes,Study the past if you would divine the future.
77,Confucius Quotes,Virtue is not left to stand alone. He who practices it will have neighbors.
78,Confucius Quotes,"Think no vice so small that you may commit it, and no virtue so small that you may over look it."
79,Confucius Quotes,Do not worry about holding high position; worry rather about playing your proper role.
80,Confucius Quotes,Do not impose on others what you yourself do not desire.
81,Confucius Quotes,"Acquire new knowledge whilst thinking over the old, and you may become a teacher of others."
82,Confucius Quotes,Sincerity and truth are the basis of every virtue.
83,Confucius Quotes,Review the old and deducing the new makes a teacher.
84,Confucius Quotes,"Act with kindness, but do not expect gratitude."
85,Confucius Quotes,Worry not that no one knows of you; seek to be worth knowing.
86,Confucius Quotes,He who conquers himself is the mightiest warrior.
87,Confucius Quotes,Ability will never catch up with the demand for it.
88,Confucius Quotes,To see and listen to the wicked is already the beginning of wickedness.
89,Confucius Quotes,"Before you embark on a journey of revenge, dig two graves."
90,Confucius Quotes,A youth is to be regarded with respect. How do you know that his future will not be equal to our present?
91,Confucius Quotes,"Fix your mind on truth, hold firm to virtue, rely on loving kindness, and find your recreation in the Arts."
92,Confucius Quotes,"Boldness, without the rules of propriety, becomes insubordination."
93,Confucius Quotes,"To be able under all circumstances to practice five things constitutes perfect virtue; these five things are gravity, generosity of soul, sincerity, earnestness, and kindness."
94,Confucius Quotes,Fine words and an insinuating appearance are seldom associated with true virtue.
95,Confucius Quotes,"The will to win, the desire to succeed, the urge to reach your full potential… these are the keys that will unlock the door to personal excellence."
0,Dr. Seuss Quotes,Being crazy isn’t enough.
1,Dr. Seuss Quotes,"They say I’m old-fashioned, and live in the past, but sometimes I think progress progresses too fast!"
2,Dr. Seuss Quotes,"Oh the things you can find, if you don’t stay behind!"
3,Dr. Seuss Quotes,In the places I go there are things that I see that I never could spell if I stopped with the Z.
4,Dr. Seuss Quotes,How did it get so late so soon? Its night before its afternoon. December is here before its June. My goodness how the time has flewn. How did it get so late so soon?
5,Dr. Seuss Quotes,"Simple it’s not, I am afraid you will find, for a mind-maker-upper to make up his mind."
6,Dr. Seuss Quotes,"I know, up on top you are seeing great sights, but down here at the bottom we, too, should have rights."
7,Dr. Seuss Quotes,"Today I shall behave, as if this is the day I will be remembered."
8,Dr. Seuss Quotes,I meant what I said and I said what I meant.
9,Dr. Seuss Quotes,"In my world, everyone’s a pony and they all eat rainbows and poop butterflies!"
10,Dr. Seuss Quotes,I’m telling you this ‘cause you’re one of my friends. My alphabet starts where your alphabet ends!
11,Dr. Seuss Quotes,"Think and wonder, wonder and think."
12,Dr. Seuss Quotes,"So be sure when you step, step with care and great tact. And remember that life’s A Great Balancing Act. And will you succeed? Yes! You will, indeed! (98 and ¾ percent guaranteed) Kid, you’ll move mountains."
13,Dr. Seuss Quotes,Only you can control your future.
14,Dr. Seuss Quotes,"You’re off to Great Places! Today is your day! Your mountain is waiting, So… get on your way!"
15,Dr. Seuss Quotes,He who makes a beast out of himself gets rid of the pain of being a man
16,Dr. Seuss Quotes,You have brains in your head. You have feet in your shoes. You can steer yourself any direction you choose. You’re on your own. And you know what you know. And YOU are the one who’ll decide where to go…
17,Dr. Seuss Quotes,Don’t cry because it’s over. Smile because it happened.
18,Dr. Seuss Quotes,"Remember me and smile, for it’s better to forget than to remember me and cry."
19,Dr. Seuss Quotes,You’ll be on your way up! You’ll be seeing great sights! You’ll join the high fliers who soar to high heights.
20,Dr. Seuss Quotes,"Just tell yourself, Duckie, you’re really quite lucky!"
21,Dr. Seuss Quotes,"With your head full of brains and your shoes full of feet, you’re too smart to go down any not-so-good street."
22,Dr. Seuss Quotes,Congratulations! Today is your day!
23,Dr. Seuss Quotes,Think! You can think any Think that you wish!
24,Dr. Seuss Quotes,Teeth are always in style.
25,Dr. Seuss Quotes,You do not like them. So you say. Try them! Try them! And you may!
26,Dr. Seuss Quotes,"And you very small persons will not have to die if you make yourselves heard! So come on, now, and TRY!"
27,Dr. Seuss Quotes,If you never did you should. These things are fun and fun is good
28,Dr. Seuss Quotes,"From there to here, from here to there, funny things are everywhere!"
29,Dr. Seuss Quotes,"I know it is wet and the sun is not sunny, but we can have lots of good fun that is funny."
30,Dr. Seuss Quotes,"When he worked, he really worked. But when he played, he really PLAYED."
31,Dr. Seuss Quotes,Day Play. We play all day. Night Fight. We fight all night.
32,Dr. Seuss Quotes,You know you’re in love when you can’t fall asleep because reality is finally better than your dreams.
33,Dr. Seuss Quotes,"I’m glad we had the times together just to laugh and sing a song, seems like we just got started and then before you know it, the times we had together were gone."
34,Dr. Seuss Quotes,To the world you may be one person; but to one person you may be the world.
35,Dr. Seuss Quotes,Adults are just obsolete children and the hell with them.
36,Dr. Seuss Quotes,Adults are just outdated children.
37,Dr. Seuss Quotes,"You make ‘em, I amuse ‘em."
38,Dr. Seuss Quotes,"Sometimes, when I see my granddaughters make small discoveries of their own, I wish I were a child."
39,Dr. Seuss Quotes,"Today you are You, that is truer than true. There is no one alive who is You-er than You."
40,Dr. Seuss Quotes,"So, open your mouth, lad! For every voice counts!"
41,Dr. Seuss Quotes,"A person’s a person, no matter how small."
42,Dr. Seuss Quotes,"If you’d never been born, then you might be an Isn’t! An Isn’t has no fun at all. No, he didn’t!"
43,Dr. Seuss Quotes,Don’t give up. I believe in you all.
44,Dr. Seuss Quotes,"I am what I am! That’s a great thing to be! If I say so my self, Happy Birthday to me!"
45,Dr. Seuss Quotes,Be who you are and say what you feel because those who mind don’t matter and those who matter don’t mind.
46,Dr. Seuss Quotes,I have heard there are troubles of more than one kind. Some come from ahead and some come from behind. But I’ve bought a big bat. I’m all ready you see. Now my troubles are going to have troubles with me!
47,Dr. Seuss Quotes,"It’s a troublesome world. All the people who are in it are troubled with troubles almost every minute. You ought to be thankful, a whole heaping lot, for the places and people you’re lucky you’re not."
48,Dr. Seuss Quotes,"Unless someone like you cares a whole awful lot, nothing is going to get better. It’s not."
49,Dr. Seuss Quotes,"If things start happening, don’t worry, don’t stew, just go right along and you’ll start happening too."
50,Dr. Seuss Quotes,"All alone! Whether you like it or not, alone is something you’ll be quite a lot!"
51,Dr. Seuss Quotes,Everything stinks till it’s finished.
52,Dr. Seuss Quotes,"I’m sorry to say so but, sadly it’s true that bang-ups and hang-ups can happen to you."
53,Dr. Seuss Quotes,Things may happen and often do to people as brainy and footsy as you.
54,Dr. Seuss Quotes,"I’m afraid sometimes you’ll play lonely games too, games you can’t win because you’ll play against you."
55,Dr. Seuss Quotes,"When you’re in a Slump, you’re not in for much fun. Un-slumping yourself is not easily done."
56,Dr. Seuss Quotes,"You’re never too old, too wacky, too wild, to pick up a book and read to a child."
57,Dr. Seuss Quotes,"The problem with writing a book in verse is, to be successful, it has to sound like you knocked it off on a rainy Friday afternoon. It has to sound easy. When you can do it, it helps tremendously because it’s a thing that forces kids to read on. You have this unconsummated feeling if you stop."
58,Dr. Seuss Quotes,‘The Lorax’ book was intended to be propaganda.
59,Dr. Seuss Quotes,"Preachers in pulpits talked about what a great message is in the book. No matter what you do, somebody always imputes meaning into your books."
60,Dr. Seuss Quotes,"I stay out of politics because if I begin thinking too much about politics, I’ll probably… drop writing children’s books and become a political cartoonist again."
61,Dr. Seuss Quotes,I am not a consecutive writer.
62,Dr. Seuss Quotes,"Whenever things go a bit sour in a job I’m doing, I always tell myself, ‘You can do better than this.’"
63,Dr. Seuss Quotes,"So the writer who breeds more words than he needs, is making a chore for the reader who reads."
64,Dr. Seuss Quotes,You have to be a speedy reader because there’s so so much to read.
65,Dr. Seuss Quotes,"You can get help from teachers, but you are going to have to learn a lot by yourself, sitting alone in a room."
66,Dr. Seuss Quotes,It is better to know how to learn than to know.
67,Dr. Seuss Quotes,"If you keep your eyes open enough, oh, the stuff you will learn. Oh, the most wonderful stuff."
68,Dr. Seuss Quotes,"Think left and think right and think low and think high. Oh, the thinks you can think up if only you try!"
69,Dr. Seuss Quotes,"There’s no limit to how much you’ll know, depending how far beyond zebra you go."
70,Dr. Seuss Quotes,"Words and pictures are yin and yang. Married, they produce a progeny more interesting than either parent."
71,Dr. Seuss Quotes,"What it really said to me is how hard the people at our school work, … All of our employees who work here are working hard to do what’s right for our kids."
72,Dr. Seuss Quotes,I would not like them here or there. I would not like them anywhere. I do not like green eggs and ham. I do not like them Sam I Am.
73,Dr. Seuss Quotes,We looked! Then we saw him. Step in on the mat! We looked! And we saw him! The Cat in the Hat!
74,Dr. Seuss Quotes,"My wonderful weapon, the Jigger-Rock Snatchem, will fling ‘em right back just as quick as we catch ‘em."
75,Dr. Seuss Quotes,"So, on beyond Z! It’s high time you were shown. That you really don’t know. All there is to be known."
76,Dr. Seuss Quotes,Just go. Go. Go! I don’t care how. You can go by foot. You can go by cow.
77,Dr. Seuss Quotes,"And that is a story that no one can beat, When I say that I saw it on Mulberry Street."
78,Dr. Seuss Quotes,"And turtles, of course… all the turtles are FREE. As turtles and, maybe, ALL creatures should be."
0,George Washington Quotes,"My mother was the most beautiful woman I ever saw. All I am I owe to my mother. I attribute all my success in life to the moral, intellectual and physical education I received from her.”“My first wish is to see this plague of mankind, war, banished from the earth."
1,George Washington Quotes,"True friendship is a plant of slow growth, and must undergo and withstand the shocks of adversity, before it is entitled to the appellation."
2,George Washington Quotes,Let us with caution indulge the supposition that morality can be maintained without religion. Reason and experience both forbid us to expect that national morality can prevail in exclusion of religious principle.
3,George Washington Quotes,"Labor to keep alive in your breast that little spark of celestial fire, called conscience."
4,George Washington Quotes,"I have always considered marriage as the most interesting event of one’s life, the foundation of happiness or misery."
5,George Washington Quotes,"If we desire to avoid insult, we must be able to repel it; if we desire to secure peace, one of the most powerful instruments of our rising prosperity, it must be known, that we are at all times ready for War."
6,George Washington Quotes,The foolish and wicked practice of profane cursing and swearing is a vice so mean and low that every person of sense and character detests and despises it.
7,George Washington Quotes,"The alternate domination of one faction over another, sharpened by the spirit of revenge natural to party dissension, which in different ages and countries has perpetrated the most horrid enormities, is itself a frightful despotism. But this leads at length to a more formal and permanent despotism."
8,George Washington Quotes,"Lenience will operate with greater force, in some instances than rigor. It is therefore my first wish to have all of my conduct distinguished by it."
9,George Washington Quotes,"We should not look back unless it is to derive useful lessons from past errors, and for the purpose of profiting by dearly bought experience."
10,George Washington Quotes,The basis of our political system is the right of the people to make and to alter their constitutions of government.
11,George Washington Quotes,"If the freedom of speech is taken away then dumb and silent we may be led, like sheep to the slaughter."
12,George Washington Quotes,The Constitution is the guide which I never will abandon.
13,George Washington Quotes,"There is nothing which can better deserve your patronage, than the promotion of science and literature. Knowledge is in every country the surest basis of public happiness."
14,George Washington Quotes,Laws made by common consent must not be trampled on by individuals.
15,George Washington Quotes,"Some day, following the example of the United States of America, there will be a United States of Europe."
16,George Washington Quotes,"I hope I shall possess firmness and virtue enough to maintain what I consider the most enviable of all titles, the character of an honest man."
17,George Washington Quotes,"Religion is as necessary to reason as reason is to religion. The one cannot exist without the other. A reasoning being would lose his reason, in attempting to account for the great phenomena of nature, had he not a Supreme Being to refer to; and well has it been said, that if there had been no God, mankind would have been obliged to imagine one."
18,George Washington Quotes,It will be found an unjust and unwise jealousy to deprive a man of his natural liberty upon the supposition he may abuse it.
19,George Washington Quotes,"Nothing can be more hurtful to the service, than the neglect of discipline; for that discipline, more than numbers, gives one army the superiority over another."
20,George Washington Quotes,Friendship is a plant of slow growth and must undergo and withstand the shocks of adversity before it is entitled to the appellation.
21,George Washington Quotes,Arbitrary power is most easily established on the ruins of liberty abused to licentiousness.
22,George Washington Quotes,"War – An act of violence whose object is to constrain the enemy, to accomplish our will."
23,George Washington Quotes,"A slender acquaintance with the world must convince every man that actions, not words, are the true criterion of the attachment of friends."
24,George Washington Quotes,"There can be no greater error than to expect, or calculate, upon real favors from nation to nation. It is an illusion which experience must cure, which a just pride ought to discard."
25,George Washington Quotes,"My observation is that whenever one person is found adequate to the discharge of a duty… it is worse executed by two persons, and scarcely done at all if three or more are employed therein."
26,George Washington Quotes,"I beg you be persuaded that no one would be more zealous than myself to establish effectual barriers against the horrors of spiritual tyranny, and every species of religious persecution."
27,George Washington Quotes,"I know of no pursuit in which more real and important services can be rendered to any country than by improving its agriculture, its breed of useful animals, and other branches of a husbandman’s cares."
28,George Washington Quotes,"The Constitution which at any time exists, ’till changed by an explicit and authentic act of the whole People is sacredly obligatory upon all."
29,George Washington Quotes,"To form a new Government, requires infinite care, and unbounded attention; for if the foundation is badly laid the superstructure must be bad."
30,George Washington Quotes,"The tumultuous populace of large cities are ever to be dreaded. Their indiscriminate violence prostrates for the time all public authority, and its consequences are sometimes extensive and terrible."
31,George Washington Quotes,"The establishment of Civil and Religious Liberty was the Motive which induced me to the Field — the object is attained — and it now remains to be my earnest wish & prayer, that the Citizens of the United States could make a wise and virtuous use of the blessings placed before them."
32,George Washington Quotes,"But if we are to be told by a foreign power what we shall do, and what we shall not do, we have Independence yet to seek, and have contended hitherto for very little."
33,George Washington Quotes,"Gentlemen, you will permit me to put on my spectacles, for, I have grown not only gray, but almost blind in the service of my country."
34,George Washington Quotes,Government is not reason and it is not eloquence. It is force! Like fire it is a dangerous servant and a fearful master. Never for a moment should it be left to irresponsible action.
35,George Washington Quotes,"I do not mean to exclude altogether the idea of patriotism. I know it exists, and I know it has done much in the present contest. But I will venture to assert, that a great and lasting war can never be supported on this principle alone. It must be aided by a prospect of interest, or some reward."
36,George Washington Quotes,"The foundations of our national policy will be laid in the pure and immutable principles of private morality, and the preeminence of free government be exemplified by all the attributes which can win the affections of its citizens, and command the respect of the world."
37,George Washington Quotes,"The preservation of the sacred fire of liberty, and the destiny of the republican model of government, are justly considered deeply, perhaps as finally, staked on the experiment entrusted to the hands of the American people."
38,George Washington Quotes,"It should be the highest ambition of every American to extend his views beyond himself, and to bear in mind that his conduct will not only affect himself, his country, and his immediate posterity; but that its influence may be co-extensive with the world, and stamp political happiness or misery on ages yet unborn."
39,George Washington Quotes,"The Hand of providence has been so conspicuous in all this, that he must be worse than an infidel that lacks faith, and more than wicked, that has not gratitude enough to acknowledge his obligations."
40,George Washington Quotes,"No country upon earth ever had it more in its power to attain these blessings than United America. Wondrously strange, then, and much to be regretted indeed would it be, were we to neglect the means and to depart from the road which Providence has pointed us to so plainly; I cannot believe it will ever come to pass."
41,George Washington Quotes,"Over grown military establishments are under any form of government inauspicious to liberty, and are to be regarded as particularly hostile to republican liberty."
42,George Washington Quotes,"Citizens by birth or choice of a common country, that country has a right to concentrate your affections. The name of American, which belongs to you, in your national capacity, must always exalt the just pride of Patriotism, more than any appellation derived from local discriminations."
43,George Washington Quotes,"I anticipate with pleasing expectations that retreat in which I promise myself to realize, without alloy, the sweet enjoyment of partaking, in the midst of my fellow citizens, the benign influence of good laws under a free government, the ever favorite object of my heart, and the happy reward, as I trust, of our mutual cares, labors, and dangers."
44,George Washington Quotes,"I hope, some day or another, we shall become a storehouse and granary for the world."
45,George Washington Quotes,The time is near at hand which must determine whether Americans are to be free men or slaves.
46,George Washington Quotes,"Jealousy, and local policy mix too much in all our public councils for the good government of the Union. In a words, the confederation appears to me to be little more than a shadow without the substance."
