,author,quotes
69,Margaret Thatcher Quotes,There is much to be said for trying to improve some disadvantaged people’s lot. There is nothing to be said for trying to create heaven on earth.
70,Margaret Thatcher Quotes,It is one of the great weaknesses of reasonable men and women that they imagine that projects which fly in the face of commonsense are not serious or being seriously undertaken.
71,Margaret Thatcher Quotes,"To me, consensus seems to be the process of abandoning all beliefs, principles, values and policies. So it is something in which no one believes and to which no one objects."
72,Margaret Thatcher Quotes,We were told our campaign wasn’t sufficiently slick. We regard that as a compliment.
73,Margaret Thatcher Quotes,"…Conservatives have excellent credentials to speak about human rights. By our efforts, and with precious little help from self-styled liberals, we were largely responsible for securing liberty for a substantial share of the world’s population and defending it for most of the rest."
74,Margaret Thatcher Quotes,If my critics saw me walking over the Thames they would say it was because I couldn’t swim.
75,Margaret Thatcher Quotes,"Oh, but you know, you do not achieve anything without trouble, ever."
76,Margaret Thatcher Quotes,Defeat? I do not recognize the meaning of the word.
77,Margaret Thatcher Quotes,"To be successful you have to be selfish, or else you never achieve. And once you get to your highest level, then you have to be unselfish. Stay reachable. Stay in touch. Don’t isolate."
78,Margaret Thatcher Quotes,"We want a society where people are free to make choices, to make mistakes, to be generous and compassionate. This is what we mean by a moral society; not a society where the state is responsible for everything, and no one is responsible for the state."
79,Margaret Thatcher Quotes,I seem to smell the stench of appeasement in the air.
80,Margaret Thatcher Quotes,"The woman’s mission is not to enhance the masculine spirit, but to express the feminine; hers is not to preserve a man-made world, but to create a human world by the infusion of the feminine element into all of its activities."
81,Margaret Thatcher Quotes,"Ought we not to ask the media to agree among themselves a voluntary code of conduct, under which they would not say or show anything which could assist the terrorists’ morale or their cause while the hijack lasted."
82,Margaret Thatcher Quotes,And what a prize we have to fight for: no less than the chance to banish from our land the dark divisive clouds of Marxist socialism.
83,Margaret Thatcher Quotes,Democratic nations must try to find ways to starve the terrorist and the hijacker of the oxygen of publicity on which they depend.
84,Margaret Thatcher Quotes,"One only gets to the top rung of the ladder by steadily climbing up one at a time, and suddenly all sorts of powers, all sorts of abilities which you thought never belonged to you–suddenly become within your own possibility and you think, Well, I’ll have a go, too."
85,Margaret Thatcher Quotes,"If it is once again one against forty-eight, then I am very sorry for the forty-eight."
86,Margaret Thatcher Quotes,Most women defend themselves. It is the female of the species — it is the tigress and lioness in you — which tends to defend when attacked.
87,Margaret Thatcher Quotes,One of the things being in politics has taught me is that men are not a reasoned or reasonable sex.
88,Margaret Thatcher Quotes,I shan’t be pulling the levers there but I shall be a very good back-seat driver.
89,Margaret Thatcher Quotes,"The world has lost one of the great champions of freedom and liberty, and America has lost a true friend. As a grocer’s daughter who rose to become Britain’s first female prime minister, she stands as an example to our daughters that there is no glass ceiling that can’t be shattered. As prime minister, she helped restore the confidence and pride that has always been the hallmark of Britain at its best. And as an unapologetic supporter of our transatlantic alliance, she knew that with strength and resolve we could win the Cold War and extend freedom’s promise.Barack Obama "
90,Margaret Thatcher Quotes,"She will be remembered not only for being Britain’s first female prime minister and holding the office for eleven years, but also for the determination and resilience with which she carried out all her duties throughout her public life. Even those who disagreed with her never doubted the strength of her convictions and her unwavering belief in Britain’s destiny in the world.Gordon Brown, Former Labour Prime Minister"
91,Margaret Thatcher Quotes,"She was a wonderful, wonderful person. I believe that history will honour her for all that she achieved and it has been a great privilege to have been by her side for the past 35 years.Cynthia Crawford, Former PA to Baroness Thatcher"
92,Margaret Thatcher Quotes,"She changed our country forever and all of us owe so much to her. A legacy few will ever equal.William Hague, Foreign Secretary"
93,Margaret Thatcher Quotes,"Margaret Thatcher’s belief in freedom and optimism about the future overcame all. Her determination is our generation’s inspiration.George Osborne, Chancellor of the Exchequer"
94,Margaret Thatcher Quotes,"Margaret Thatcher was a truly formidable prime minister whose policies defined a political generation.Alex Salmond, Scottish First Minister"
0,Marilyn Monroe Quotes,"In Hollywood a girl’s virtue is much less important than her hairdo. You’re judged by how you look, not by what you are. Hollywood’s a place where they’ll pay you a thousand dollars for kiss, and fifty cents for your soul. I know, because I turned down the first offer often enough and held out for the fifty."
1,Marilyn Monroe Quotes,I’m very definitely a woman and I enjoy it.
2,Marilyn Monroe Quotes,"Everybody is always tugging at you. They’d all like a sort of chunk out of you. I don’t think they realize it, but it’s like ‘grrr do this, grr do that…’But you do want to stay intact and on two feet."
3,Marilyn Monroe Quotes,A woman can’t be alone. She needs a man. A man and a woman support and strengthen each other. She just can’t do it by herself.
4,Marilyn Monroe Quotes,"I always felt insecure and in the way, but most of all I felt scared. I guess I wanted love more than anything else in the world."
5,Marilyn Monroe Quotes,"If I’m a star, then the people made me a star."
6,Marilyn Monroe Quotes,"Creativity has got to start with humanity and when you’re a human being, you feel, you suffer."
7,Marilyn Monroe Quotes,Success makes so many people hate you. I wish it wasn’t that way. It would be wonderful to enjoy success without seeing envy in the eyes of those around you.
8,Marilyn Monroe Quotes,"Fame will go by and, so long, I’ve had you, Fame. If it goes by, I’ve always known it was fickle."
9,Marilyn Monroe Quotes,The most unsatisfactory men are those who pride themselves on their virility and regard sex as if it were some form of athletics at which you can win cups. It is a woman’s spirit and mood a man has to stimulate in order to make sex interesting. The real lover is the man who can thrill you just by touching your head or smiling into your eyes or by just staring into space.
10,Marilyn Monroe Quotes,"First, I’m trying to prove to myself that I’m a person. Then maybe I’ll convince myself that I’m an actress."
11,Marilyn Monroe Quotes,"This life is what you make it. No matter what, you’re going to mess up sometimes, it’s a universal truth. But the good part is you get to decide how you’re going to mess it up."
12,Marilyn Monroe Quotes,"With fame, you know, you can read about yourself, somebody else’s ideas about you, but what’s important is how you feel about yourself – for survival and living day to day with what comes up."
13,Marilyn Monroe Quotes,"I want to grow old without facelifts… I want to have the courage to be loyal to the face I’ve made. Sometimes I think it would be easier to avoid old age, to die young, but then you’d never complete your life, would you? You’d never wholly know you."
14,Marilyn Monroe Quotes,Arthur Miller wouldn’t have married me if I had been nothing but a dumb blonde.
15,Marilyn Monroe Quotes,"No one ever told me I was pretty when I was a little girl. All little girls should be told they’re pretty, even if they aren’t."
16,Marilyn Monroe Quotes,I think that when you are famous every weakness is exaggerated.
17,Marilyn Monroe Quotes,"Respect is one of life’s greatest treasures. I mean, what does it all add up to if you don’t have that?"
18,Marilyn Monroe Quotes,"I won’t be satisfied until people want to hear me sing without looking at me. Of course, that doesn’t mean I want them to stop looking."
19,Marilyn Monroe Quotes,I’m one of the world’s most self-conscious people. I really have to struggle.
20,Marilyn Monroe Quotes,"Fame is fickle, and I know it. It has its compensations but it also has its drawbacks, and I’ve experienced them both."
21,Marilyn Monroe Quotes,Sometimes I feel my whole life has been one big rejection.
22,Marilyn Monroe Quotes,I think that sexuality is only attractive when it’s natural and spontaneous.
23,Marilyn Monroe Quotes,"A man is more frank and sincere with his emotions than a woman. We girls, I’m afraid, have a tendency to hide our feelings."
24,Marilyn Monroe Quotes,My work is the only ground I’ve ever had to stand on. I seem to have a whole superstructure with no foundation but I’m working on the foundation.
25,Marilyn Monroe Quotes,I’m one of the world’s most self-conscious people. I really have to struggle.
26,Marilyn Monroe Quotes,I don’t consider myself an intellectual. And this is not one of my aims. But I admire intellectual people.
27,Marilyn Monroe Quotes,"I’m a failure as a woman. My men expect so much of me, because of the image they’ve made of me– and that I’ve made of myself– as a sex symbol. They expect bells to ring and whistles to whistle, but my anatomy is the same as any other woman’s and I can’t live up to it."
28,Marilyn Monroe Quotes,"A wise girl kisses but doesn’t love, listens but doesn’t believe, and leaves before she is left."
29,Marilyn Monroe Quotes,"I don’t mind living in a man’s world, as long as I can be a woman in it."
30,Marilyn Monroe Quotes,"If I play a stupid girl and ask a stupid question, I’ve got to follow it through, what am I supposed to do, look intelligent?"
31,Marilyn Monroe Quotes,It’s far better to be unhappy alone than unhappy with someone — so far.
32,Marilyn Monroe Quotes,"I don’t know who invented high heels, but all women owe him a lot!"
33,Marilyn Monroe Quotes,"Before marriage, a girl has to make love to a man to hold him. After marriage, she has to hold him to make love to him."
34,Marilyn Monroe Quotes,If you’re gonna be two-faced at least make one of them pretty.
35,Marilyn Monroe Quotes,I’ve never fooled anyone. I’ve let people fool themselves. They didn’t bother to find out who and what I was. Instead they would invent a character for me. I wouldn’t argue with them. They were obviously loving somebody I wasn’t.
36,Marilyn Monroe Quotes,It’s not true that I had nothing on. I had the radio on.
37,Marilyn Monroe Quotes,I love to do the things the censors won’t pass.
38,Marilyn Monroe Quotes,"When it comes down to it, I let them think what they want. If they care enough to bother with what I do, then I’m already better than them."
39,Marilyn Monroe Quotes,"I don’t mind making jokes, but I don’t want to look like one."
40,Marilyn Monroe Quotes,"I knew I belonged to the public and to the world, not because I was talented or even beautiful, but because I had never belonged to anything or anyone else."
41,Marilyn Monroe Quotes,It’s often just enough to be with someone. I don’t need to touch them. Not even talk. A feeling passes between you both. You’re not alone.
42,Marilyn Monroe Quotes,Dogs never bite me. Just humans.
43,Marilyn Monroe Quotes,In spite of everything life is not without hope.
44,Marilyn Monroe Quotes,A girl doesn’t need anyone that doesn’t need her.
45,Marilyn Monroe Quotes,"The body is meant to be seen, not all covered up."
46,Marilyn Monroe Quotes,All we demanded was our right to twinkle.
47,Marilyn Monroe Quotes,"I don’t mind being burdened with being glamorous and sexual. Beauty and femininity are ageless and can’t be contrived, and glamour, although the manufacturers won’t like this, cannot be manufactured. Not real glamour; it’s based on femininity."
48,Marilyn Monroe Quotes,All a girl really wants is for one guy to prove to her that they are not all the same.
49,Marilyn Monroe Quotes,Ever notice how ‘What the hell’ is always the right answer?
50,Marilyn Monroe Quotes,I don’t stop when I’m tired. I only stop when I’m done.
51,Marilyn Monroe Quotes,Sex is part of nature. I go along with nature.
52,Marilyn Monroe Quotes,"How wrong it is for a woman to expect the man to build the world she wants, rather than to create it herself."
53,Marilyn Monroe Quotes,"Keep smiling, because life is a beautiful thing and there’s so much to smile about."
54,Marilyn Monroe Quotes,"What do I wear in bed? Why, Chanel No. 5, of course."
55,Marilyn Monroe Quotes,"Boys think girls are like books, If the cover doesn’t catch their eye they won’t bother to read what’s inside."
56,Marilyn Monroe Quotes,Just because you fail once doesn’t mean you’re gonna fail at everything.
57,Marilyn Monroe Quotes,Who said nights were for sleep?
58,Marilyn Monroe Quotes,"It’s all make believe, isn’t it?"
59,Marilyn Monroe Quotes,I read poetry to save time.
60,Marilyn Monroe Quotes,You might as well make yourself fly as to make yourself love.
61,Marilyn Monroe Quotes,That’s the way you feel when you’re beaten inside. You don’t feel angry at those who’ve beaten you. You just feel ashamed.
62,Marilyn Monroe Quotes,Always remember to smile and look up at what you got in life.
63,Marilyn Monroe Quotes,"Looking back, I guess I used to play-act all the time. For one thing, it meant I could live in a more interesting world than the one around me."
64,Marilyn Monroe Quotes,"Maybe I’ll never be able to do what I hope to, but at least I have hope."
65,Marilyn Monroe Quotes,Men are always ready to respect anything that bores them.
66,Marilyn Monroe Quotes,I’ve often stood silent at a party for hours listening to my movie idols turn into dull and little people.
67,Marilyn Monroe Quotes,I am not a victim of emotional conflicts. I am human.
68,Marilyn Monroe Quotes,"People had a habit of looking at me as if I were some kind of mirror instead of a person. They didn’t see me, they saw their own lewd thoughts, then they white-masked themselves by calling me the lewd one."
69,Marilyn Monroe Quotes,Millions of people live their entire lives without finding themselves. But it is something I must do.
70,Marilyn Monroe Quotes,"For those who are poor in happiness, each time is a first time; happiness never becomes a habit."
71,Marilyn Monroe Quotes,Most men judge your importance in their lives by how much you can hurt them.
72,Marilyn Monroe Quotes,"I don’t forgive people because I’m weak, I forgive them because I am strong enough to know people make mistakes."
73,Marilyn Monroe Quotes,Please quote me right!
74,Marilyn Monroe Quotes,"The ‘public’ scares me, but people I trust."
75,Marilyn Monroe Quotes,"I have always been deeply terrified to really be someone’s wife since I know from life one cannot love another, ever, really."
76,Marilyn Monroe Quotes,"Anything’s possible, almost."
77,Marilyn Monroe Quotes,"This is supposed to be an art form, not just a manufacturing establishment. The sensitivity that helps me to act, you see, also makes me react. An actor is supposed to be a sensitive instrument."
78,Marilyn Monroe Quotes,I never wanted to be Marilyn — it just happened. Marilyn’s like a veil I wear over Norma Jeane.
79,Marilyn Monroe Quotes,Its not too much fun to know yourself too well or think you do — everyone needs a little conceit to carry them through and past the falls.
80,Marilyn Monroe Quotes,This is a free and democratic country and no one has a monopoly on anything.
81,Marilyn Monroe Quotes,"For life: it is rather a determination not to be overwhelmed. For work: the truth can only be recalled, never invented."
82,Marilyn Monroe Quotes,"I’m trying to find the nailhead, not just strike the blow."
83,Marilyn Monroe Quotes,"Men are climbing to the moon, but they don’t seem interested in the beating human heart."
84,Marilyn Monroe Quotes,It takes a smart brunette to play a dumb blonde.
85,Marilyn Monroe Quotes,"Acting isn’t something you do. Instead of doing it, it occurs. If you’re going to start with logic, you might as well give up. You can have conscious preparation, but you have unconscious results."
86,Marilyn Monroe Quotes,I love a natural look in pictures. I like people with a feeling one way or another — it shows an inner life. I like to see that there’s something going on inside them.
87,Marilyn Monroe Quotes,"She’d come out of our apartment in a shleppy old coat, looking like my maid, and all the people would push her aside to get my autograph. She loved it.Shelley Winters"
88,Marilyn Monroe Quotes,"I was very, very drawn to her. To me, she was like a golden child. She radiated light and vulnerability. She used to gravitate to me at parties because she knew I was not very secure either. She was fragile. I was very touched by her.Jane Fonda"
89,Marilyn Monroe Quotes,"She was trying to prove she was a serious actress and not just a movie star playing bimbo parts,” said Murray, who earned an Oscar nomination as Beau. “She was trying to prove she was an actress of substance, and in my opinion she certainly did.Don Murray"
90,Marilyn Monroe Quotes,"I never saw anybody work so hard, but it wasn’t an easy ride. She did such a good job and personally, I think she stole the whole damn show. I just think she was thrown into a nest of vipers.Mitzi Gaynor"
0,Mark Cuban Quotes,It doesn’t matter how many times you fail. You only have to be right once and then everyone can tell you that you are an overnight success.
1,Mark Cuban Quotes,"I look at my annual budgets for everything and anything, and I look to see where I can save the most money on those items. Saving 30% to 50% buying in bulk – replenishable items from toothpaste to soup, or whatever I use a lot of – is the best guaranteed return on investment you can get anywhere."
2,Mark Cuban Quotes,"Don’t start a company unless it’s an obsession and something you love. If you have an exit strategy, it’s not an obsession."
3,Mark Cuban Quotes,"I’m a believer that you accomplish much, much more with direct relationships than by using an intermediary. And that cash you keep in the bank can be the difference between staying alive as a small business, or not."
4,Mark Cuban Quotes,"If you’ve got $25,000, $50,000, $100,000, you’re better off paying off any debt you have because that’s a guaranteed return."
5,Mark Cuban Quotes,"I wouldn’t be where I am now if I didn’t fail a lot. The good, the bad, it’s all part of the success equation."
6,Mark Cuban Quotes,What I’ve learned in these 11 years is you got to stay focused and believe in yourself and trust your own ability and judgment.
7,Mark Cuban Quotes,"Everyone is passionate about something. Usually more than one thing. We are born with it. There are always going to be things we love to do. That we dream about doing. That we really, really want to do with our lives. Those passions aren’t worth a nickel."
8,Mark Cuban Quotes,It’s not whom you know. It’s not how much money you have. It’s very simple. It’s whether or not you have the edge and have the guts to use it.
9,Mark Cuban Quotes,Always ask yourself how someone could preempt your product or service.
10,Mark Cuban Quotes,Do we know what we are designed to be or do we find out through experience?
11,Mark Cuban Quotes,"With every effort, I learned a lot. With every mistake, I learned what not to do."
12,Mark Cuban Quotes,"The edge is knowing people think you’re crazy, and they’re right, but you don’t care what they think."
13,Mark Cuban Quotes,Everyday I look in the mirror and make sure I don’t pinch myself so I don’t wake up. I don’t take it for granted. All the time I say ‘Why me?’
14,Mark Cuban Quotes,It’s always better if you’re honest with yourself and anticipate where the problems could come from.
15,Mark Cuban Quotes,"I had to kick myself in the ass and recommit to getting up early, staying up late and consuming anything I possibly could to get an edge."
16,Mark Cuban Quotes,Relaxing is for the other guy.
17,Mark Cuban Quotes,"Wherever I see people doing something the way it’s always been done, the way it’s ‘supposed’ to be done, following the same old trends, well, that’s just a big red flag to me to go look somewhere else."
18,Mark Cuban Quotes,"I still work hard to know my business. I’m continuously looking for ways to improve all my companies, and I’m always selling. Always."
19,Mark Cuban Quotes,I worked hard and smarter than most people in the businesses I have been in.
20,Mark Cuban Quotes,Always wake up with a smile knowing that today you are going to have fun accomplishing what others are too afraid to do.
21,Mark Cuban Quotes,Because if you’re prepared and you know what it takes. It’s not a risk. You just have to figure out how to get there. There is always a way to get there.
22,Mark Cuban Quotes,"Learn to sell. In business you’re always selling – to your prospects, investors and employees. To be the best salesperson put yourself in the shoes of the person to whom you are selling. Don’t sell your product. Solve their problem."
23,Mark Cuban Quotes,"If you have managers reporting to managers in a startup, you will fail. Once you get beyond startup, if you have managers reporting to managers, you will create politics."
24,Mark Cuban Quotes,Pay attention to what’s happening around you. Don’t think there’s just one way to do things—context is everything.
25,Mark Cuban Quotes,One of the most underrated skills in business right now is being nice.
26,Mark Cuban Quotes,"In every business I have had, I have made sure my customers have had my email address and can reach me directly."
27,Mark Cuban Quotes,"Great entrepreneurs invest the time, no matter how many hours a day, to learn more about their industry and the business they want to start than anyone else."
28,Mark Cuban Quotes,What is your grind?
29,Mark Cuban Quotes,"It’s not about money or connections, it’s the willingness to outwork and outlearn everyone when it comes to your business. And if it fails, you learn from what happened and do a better job next time."
30,Mark Cuban Quotes,"What I do know, at least what I think I have learned from my experiences in business, is that when there is a rush for everyone to do the same thing, it becomes more difficult to do. Not easier. Harder."
31,Mark Cuban Quotes,"Being rich is a good thing. Not just in the obvious sense of benefiting you and your family, but in the broader sense. Profits are not a zero sum game. The more you make, the more of a financial impact you can have."
32,Mark Cuban Quotes,"The one person who you should never believe when it comes to evaluating your abilities is you. The very worst judge of your abilities is you. Self-evaluation is never successful. When you are the best at something, the demand for your services will grow. People want to hire the best. They want to be associated with the best."
33,Mark Cuban Quotes,"In my opinion, right now, there’s way too much hype on the technologies and not enough attention to the real businesses behind them."
34,Mark Cuban Quotes,"Your biggest enemies are your bills. The more you owe, the more you stress. The more you stress over bills, the more difficult it is to focus on your goals. More importantly, if you set your monthly income requirements too high, you eliminate a significant number of opportunities. The cheaper you can live, the greater your options."
35,Mark Cuban Quotes,"If you’re looking where everybody else is looking, you’re looking in the wrong spot."
36,Mark Cuban Quotes,"Once you have found out what you love to do, there is only one goal: How can you be the best in the world at it. It doesn’t matter if you are a filing clerk, athlete, accountant, or bartender. All that matters is that you do whatever you can to be the best."
37,Mark Cuban Quotes,"Focus on building the best possible business. If you are great, people will notice and opportunities will appear."
38,Mark Cuban Quotes,Sweat equity is the most valuable equity there is. Know your business and industry better than anyone else in the world. Love what you do or don’t do it.
39,Mark Cuban Quotes,Entrepreneurs have to be brutally honest with themselves and recognize where they have added value and where they have gone along for the ride.
40,Mark Cuban Quotes,"I retired at twenty-nine, bought a life-time pass on American Airlines and my only goal in life was to party like a mad man and get drunk with as many people as possible. And I was happy right there. But when we started the streaming business, I knew it could be something big."
41,Mark Cuban Quotes,You have to learn how to use time wisely and be productive. How wisely you use your time will have far more impact on your life and success than any amount of money.
42,Mark Cuban Quotes,Those back-to-back experiences confirmed what I already knew: That I was a shitty-ass employee and I’d better start my own business.
